"Rank","Song","Artist","Year","Lyrics","Source"
8,"candle in the wind 1997","elton john",1998," goodbye englands rose may you ever grow in our hearts you were the grace that placed itself where lives were torn apart you called out to our country and you whispered to those in pain now you belong to heaven and the stars spell out your nameand it seems to me you lived your life like a candle in the wind never fading with the sunset when the rain set in and your footsteps will always fall here along englands greenest hills your candles burned out long before your legend ever willloveliness weve lost these empty days without your smile this torch well always carry for our nations golden child and even though we try the truth brings us to tears all our words cannot express the joy you brought us through the yearsand it seems to me you lived your life like a candle in the wind never fading with the sunset when the rain set in and your footsteps will always fall here along englands greenest hills your candles burned our long before your legend ever willgoodbye englands rose may you ever grow in our hearts you were the grace that placed itself where lives were torn apart goodbye englands rose from a country lost without your soul wholl miss the wings of your compassion more than youll ever knowand it seems to me you lived your life like a candle in the wind never fading with the sunset when the rain set in and your footsteps will always fall here along englands greenest hills your candles burned out long before your legend ever will ",1
9,"nice  slow","usher",1998,"ah whatcha doing really you know im coming over right now baby tell me what you wanna do with me now you got it hot for me already baby okay ill be there in about uh give me ten minutes be ready eh wear that little thing i like now baby tell me what you wanna do with me its seven oclock on the dot im in my drop top cruisin the streets i gotta real pretty pretty little thing thats waiting for me i pull up anticipating good love dont keep me waiting i got plans to put my hands in places ive never seen girl you know what i mean let me take you to a place nice and quiet where there aint no one there to interrupt aint gotta rush i just wanna take it nice and slow now baby tell me what you wanna do with me see i been waiting for this for so long well be making love until the sun comes up baby i just wanna take it nice and slow now baby tell me what you wanna do with me now here we are driving around town contemplating where im gonna lay you down girl you got me saying my my my i wish that i could pull over and get this thing started right now i wanna do something freaky to you babe i dont think they heard me i i wanna do something freaky to you babe so call out my name they call me u s h e r  r a y m o n d now baby tell me what you wanna do with me gotta nigga feenin like jodeci every time that you role with me holding me trying to get control of me nice and slowly you know never lettin go never messin up the flow incomprehensible go come on 220 let me take you to a place nice and quiet where there aint no one there to interrupt aint gotta rush i just wanna take it nice and slow now baby tell me what you wanna do with me see i been waiting for this for so long well be making love until the sun comes up baby i just wanna take it nice and slow now baby tell me what you wanna do with me now tell me do you wanna get freaky coz ill freak you right i will ill freak you right i will ill freak you like no one has ever ever made you feel ill freak you right i will ill freak you right i will ill freak you freak you like no one has ever made you feel yeah now baby tell me what you wanna do with me now baby tell me what you wanna do with me",3
10,"i dont want to wait","paula cole",1998," so open up your morning light and say a little prayer for i you know that if we are to stay alive then see the peace in every eyeshe had two babies one was six months one was three in the war of 44 every telephone ring every heartbeat stinging when she thought it was god calling her oh would her son grow to know his fatheri dont want to wait for our lives to be over i want to know right now what will it be i dont want to wait for our lives to be over will it be yes or will it be sorryhe showed up all wet on the rainy front step wearing shrapnel in his skin and the war he saw lives inside him still its so hard to be gentle and warm the years pass by and now he has granddaughtersi dont want to to wait for our lives to be over i want to know right now what will it be i dont want to wait for our lives to be over will it be yes or will it be sorryyou look at me from across the room youre wearing your anguish again believe me i know the feeling it sucks you into the jaws of anger so breathe a little more deeply my love all we have is this very moment and i dont want to do what his father and his father and his father did i want to be here now so open up your morning light and say a little prayer for i you know that if we are to stay alive then see the peace in every eyei dont want to to wait for our lives to be over i want to know right now what will it be i dont want to wait for our lives to be over will it be yes or will it be sorry ",1
11,"hows it going to be","third eye blind",1998," im only pretty sure that i cant take anymore before you take a swing i wonder what are we fighting for when i say out loud i want to get out of this i wonder is there anything im going to miss i wonder how its going to be when you dont know me hows it going to be when youre sure im not there hows it going to be when theres no one there to talk to between you and me cause i dont care hows it going to be hows it going to be where we used to laugh theres a shouting match sharp as a thumbnail scratch a silence i cant ignore like the hammock by the doorway we spent time in swings empty dont see lightning like last fall when it was always about to hit me i wonder hows it going to be when it goes down hows it going to be when youre not around hows it going to be when you found out there was nothing between you and me cause i dont care hows it going to be and hows it going to be when you dont know me anymore and hows it going to be want to get myself back in again the soft dive of oblivion i want to taste the salt of your skin the soft dive of oblivion oblivion hows it going to be when you dont know me anymore hows it going to be hows it going to be hows it going to be ",1
12,"no no no","destinys child",1998," this is the remix the jeeps pump this new remix this is the remix radios play this remix this is the remix the croups pump this remix this is the remix the refugees camp have the remixdestinys child we bout to set it this is the remix the streets pump the remix this is the remix every project come on come on destinys childboy i know you want me i can see it in your eyes but you keep on fronting wont you say whats on your mind cause each and every time you need me you give me signs but when i ask you whats the deal you hold it all insideif you wanna be with me you gotta keep it real tell me whats goin on tell me how you feel cause boy i know you want me just as much as i want you so come and get my love its all here for youyoull be saying no no no no no when its really yeah yeah yeah yeah yeah youll be saying no no no no no when its really yeah yeah yeah yeah yeahyoull be saying no no no no no when its really yeah yeah yeah yeah yeah youll be saying no no no no no when its really yeah yeah yeah yeah yeahif you keep actin this way youre gonna lose my love i aint got no time to play you better hurry up cause every time i come around crews run around your way i see you on the corner but you dont know what to saywhen i walk up to you baby you seem so shy whats the problem baby never had a girl like i i can see right through you and you know you wanna be mine so get your act together cause youre running out of timeyoull be saying no no no no no when its really yeah yeah yeah yeah yeah youll be saying no no no no no when its really yeah yeah yeah yeah yeahyoull be saying no no no no no when its really yeah yeah yeah yeah yeah youll be saying no no no no no when its really yeah yeah yeah yeah yeahevery time i see you with your boys you pretend as if you dont want me when you get home you call me on the phone and tell me how much you careyo close your eyes shorty youre guaranteed to be hypnotized by the remix that wyclef provides i dont care bout your sizegirl shake your thighs all im tryin to do in the hood is stay alive make a little money with destinys childthugs hear this song they dance they go wild like texas they movin like no limit soldiers they went from a dream to the young supremes sing it girlsyoull be saying no no no no no when its really yeah yeah yeah yeah yeah youll be saying no no no no no when its really yeah yeah yeah yeah yeahyoull be saying no no no no no when its really yeah yeah yeah yeah yeah youll be saying no no no no no when its really yeah yeah yeah yeah yeahyoull be saying no no no no no when its really yeah yeah yeah yeah yeah youll be saying no no no no no when its really yeah yeah yeah yeah yeahyoull be saying no no no no no when its really yeah yeah yeah yeah yeah youll be saying no no no no no when its really yeah yeah yeah yeah yeah ",1
13,"my heart will go on","celine dion",1998," every night in my dreams i see you i feel you that is how i know you go onfar across the distance and spaces between us you have come to show you go onnear far wherever you are i believe that the heart does go on once more you open the door and youre here in my heart and my heart will go on and onlove can touch us one time and last for a lifetime and never let go till were gonelove was when i loved you one true time i hold to in my life well always go onnear far wherever you are i believe that the heart does go on once more you open the door and youre here in my heart and my heart will go on and onyoure here theres nothing i fear and i know that my heart will go on well stay forever this way you are safe in my heart and my heart will go on and on ",1
14,"gettin jiggy wit it","will smith",1998," on your mark ready set lets go dance floor pro i know you know i go psycho when my new joint hit just cant sit got to get jiggy wit it thats it now honey honey come ride dkny all up in my eye you gotta prada bag with a lot a stuff in it give it to your friend lets spin everybody lookin at me glancin the kid wish you nig was dancin the jig here with this handsome kid cigacigar right from cubacuba i just bite it its for the look i dont light it illway the amay on the anceday orflay give it up jiggy make it feel like foreplay yo my cardio is infinite ha ha big willie styles all in itgettin jiggy wit it na na na na na na na nana na na na na nana gettin jiggy wit it na na na na na na na nana na na na na nana gettin jiggy wit it na na na na na na na nana na na na na nana gettin jiggy wit it na na na na na na na nana na na na na nanawhat you want to ball with the kid watch your step you might fall trying to do what i did mamaunh mamaunh mama come closa in the middle of the club with the rubadub no love for the haters mad cause i got floor seats at the lakers see me on the fifty yard line with the raiders met ali he told me im the greatest i got the fever for the flavor of a crowd pleaser dj play another from the prince of this your highness only bad chicks ride in my whips south to the west to the east to the north bought my hits and watch em go off a go off ah yes yes yall ya dont stop in the winter or the summertime i makes it hotgettin jiggy wit it na na na na na na na nana na na na na nana gettin jiggy wit it na na na na na na na nana na na na na nana gettin jiggy wit it na na na na na na na nana na na na na nana gettin jiggy wit it na na na na na na na nana na na na na nanaeightfifty is if you need a lift whos the kid in the drop who else will smith livin that life some consider a myth rock from south street to one two fifth women used to tease me give it to me now nice and easy since i moved up like george and wheezey cream to the maximum i be askin em would you like to bounce with the brother thats platinum never see will attackin em i rather play ball with shaq and em flatten em psyche hittin you thought i took a spill but i didnt trust the lady of my life she hittin hit her with a drop top with the ribbon crib for my mom on the outskirts of philly you trying to flex on me dont be sillygettin jiggy wit it na na na na na na na nana na na na na nana gettin jiggy wit it na na na na na na na nana na na na na nana gettin jiggy wit it na na na na na na na nana na na na na nana gettin jiggy wit it na na na na na na na nana na na na na nana ",1
15,"you make me wanna","usher",1998," this is what you do this is what you do this is what you do this is what you doyou make me wanna leave the one im with to start a new relationship with you this is what you do think about a ring and all the things that come along with you make me you make me wannaleave the one im with to start a new relationship with you this is what you do think about a ring and all the things that come along with you make me you make mebefore anything came between us you were like my best friend the one i used to run an talk to when me and my girl was having problems you used to say it would be okay suggest little nice things i should do and when i come home at night and lay my head down all i seem to think about is you and howyou make me wanna leave the one im with to start a new relationship with you this is what you do think about a ring and all the things that come along with you make me you make me wannaleave the one im with to start a new relationship with you this is what you do think about a ring and all the things that come along with you make me you make menow whats bad is youre the one that hooked us up knowing it shouldve been you whats sad is i love her but im falling for you what should i do should i tell my baby byebye should i do exactly what i feel inside cause i i dont wanna go dont need to stay but i really need to get it togetheryou make me wanna leave the one im with to start a new relationship with you this is what you do think about a ring and all the things that come along with you make me you make me wannaleave the one im with to start a new relationship with you this is what you do think about a ring and all the things that come along with you make me you make meat this point the situations out of control i never meant to hurt her but i gotta let her go and if she may not understand it why all of this is going on i tried i tried to fight it but the feelings just to strongyou make me wanna you make me wanna you make me wanna you make me wannayou make me wanna you make me wanna you make me wanna come along with you make meyou make me wanna leave the one im with to start a new relationship with you this is what you do think about a ring and all the things that come along with you make me you make me wannaleave the one im with to start a new relationship with you this is what you do think about a ring and all the things that come along with you make me you make meyou make me wanna leave the one im with to start a new relationship with you this is what you do think about a ring and all the things that come along with you make me you make me wannaleave the one im with to start a new relationship with you this is what you do ",1
16,"my way","usher",1998," yo see its rare that you find people like us cause yall the other look out there doin what im doin or tryin to do what im doin but you cant cause i do what i do my way what about you huh huh come oni do any and everything you want to make your girl say ooh ooh whys he so flyshe beeps me whenever she wanna get freaky you can get mad if you want too do whatever you want but she still gon give it up she likes itmy way my way my way you cant satisfy her needs she keeps runnin back to see me do it my way my way what i say goes and im in controldont check me check me it was your girl who let me let me take it this far then ooh wee ooh we she had to have every chance that she could get but you think you a baller and i aint gon call her clip that you can get mad if you want to say whatever you want but she still gon give it up cause she likes itmy way ooh my way you cant satisfy her needs she keeps runnin back to see me do it my way my way what i say goes and im in controlim standing here where you ought to be got you mad at me cause i got your lady you aint got to worry i aint trying to romance all i wanna do is make her dance with memy way oh my way my way you cant satisfy her needs she keeps runnin back to see me do it my way my way what i say goes and im in controlmy way my way you cant satisfy her needs she keeps runnin back to see me do it my way my way and what i say goes and im in controlmy way my way you cant satisfy her needs she keeps runnin back to see me do it my way my way what i say goes and im in control ",1
17,"my all","mariah carey",1998," i am thinking of you in my sleepless solitude tonight if its wrong to love you then my heart just wont let me be right cause ive drowned in you and i wont pull through without you by my sideid give my all to have just one more night with you id risk my life to feel your body next to mine cause i cant go on living in the memory of our song id give my all for your love tonightbaby can you feel me imagining im looking in your eyes i can see you clearly vividly emblazoned in my mind and yet youre so far like a distant star im wishing on tonightid give my all to have just one more night with you id risk my life to feel your body next to mine cause i cant go on living in the memory of our song id give my all for your love tonight ",1
18,"the first night","monica",1998,"baby baby tell me whats up can you hear me or do i do i need to turn it up huh huh baby baby tell me whats up can you hear me or do i do i need to turn it up huh what baby baby tell me whats up can you hear me or do i do i need to turn it up huh huh baby baby tell me whats up can you hear me or do i do i need to turn it up huh what boy this evening was it only me feeling completely down to be open down to be open for some satisfaction didnt want to say yes afraid of your reaction i knew it was wrong for feeling this way especially the thought of givin in on the first date couldnt let go it stayed on my mind at the end of the night i had to decide i was thinkin i should make a move but i wont i know your probly thinkin something is wrong knowing if i do that it wont be right i dont get down on the first night i should make a move but i wont and then you probly thinkin something is wrong knowing if i do that it wont be right i wanna get down but not the first night we was chillin watching your tv i felt it was comin the closer that you got to me wanted to touch you wanted to kiss you and some how in one night discover i love you felt so right but it felt so wrong and look how were caryin on tryin to say things to get me to stay but my watch is telling me its getting to late im thinkin i should make a move but i wont i know your probly thinkin something is wrong knowing if i do that it wont be right i dont get down on the first night i should make a move but i wont i know you probly thinkin something is wrong knowing if i do that it wont be right i wanna get down but not the first night if you want me you got to know me and if you want my love you gotta wait my love baby thats the way its got to be get to know me so we can do this ooh i should i know your probably thinkin knowin if i do i dont get down on the first night i should make a move but i wont i know your probably thinkin something is wrong knowing if i do that it wont be right i wanna get down but not the first night i should make a move but i wont i know your probably thinkin something is wrong knowing if i do that it wont be right i dont get down on the first night i should make a move but i wont i know your probably thinkin something is wrong knowing if i do that it wont be right i wanna get down but not the first night i should make a move but i wont i know your probably thinkin something is wrong knowing if i do that it wont be right i dont get down on the first night i should make a move but i wont i know your probably thinkin something is wrong knowing if i do that it wont be right i wanna get down but not the first night",3
