"Rank","Song","Artist","Year","Lyrics","Source"
24,"ruby tuesday","the rolling stones",1967,"she would never say where she came from yesterday dont matter when its gone while the sun is bright or in the darkest night no one knows she comes and goes goodbye ruby tuesday who could hang a name on you when you smile with every new day still im gonna miss you dont question why she needs to be so free shell tell you its the only way to be she just cant be chained to a life where nothings gained and nothings lost at such a cost theres no time to lose i heard her say catch your dreams before they slip away dying all the time lose your dreams and you will lose your mind aint life unkind goodbye ruby tuesday who could hang a name on you when you smile with every new day still im gonna miss you",3
25,"it must be him","vikki carr",1967," i tell myself whats done is done i tell myself dont be a fool play the field have a lot of fun its easy when you play it cooli tell myself dont be a chump who cares let him stay away thats when the phone rings and i jump and as i grab the phone i praylet it please be him oh dear god it must be him it must be him or i shall die or i shall dieoh hello hello my dear god it must be him but its not him and then i die thats when i dieafter a while im myself again i pick the pieces off the floor put my heart on the shelf again youll never hurt me anymoreim not a puppet on a string ill find somebody else someday thats when the phone rings and once again i start to praylet it please be him oh dear god it must be him  it must be him or i shall die or i shall dieoh hello hello my dear god it must be him but its not him and then i die again i dielet it please be him oh dear god it must be him  it must be him or i shall die or i shall die ",1
26,"love is here and now youre gone","the supremes",1967," love is here and oh my darling now youre gone love is here and oh my darling now youre gone you persuaded me to love you and i did but instead of tenderness i found heartache instead into your arms i fell so unaware of the loneliness that was waiting there you closed the door of your heart and turned the key locked your love away from melove is here and oh my darling now youre gone you made me love you and oh my darling now youre gone you said loving you would make life beautiful with each passing day but as soon as love came into my heart you turned and you walked just one way you stripped me of my dreams you gave me faith then took my hope look at me nowlook at me see what loving you has done to me look at my face see how crying has left its trace after you made me all your own and you left me all alone you made your words sound so sweet knowing that your love i couldnt keep my heart cries out for your touch but youre not there and the lonely cry fades in the airlove is here and oh my darling now youre gone love is here and oh my darling now youre gone you made me love you oh my darling now youre gone you made me love you oh my darling now youre gone ",1
27,"for what its worth","buffalo springfield",1967," theres something happening here what it is aint exactly clear theres a man with a gun over there telling me i got to bewarei think its time we stop children whats that sound everybody look whats going downtheres battle lines being drawn nobodys right if everybodys wrong young people speaking their minds getting so much resistance from behindits time we stop hey whats that sound everybody look whats going downwhat a fieldday for the heat a thousand people in the street singing songs and carrying signs mostly say hooray for our sideits s time we stop hey whats that sound everybody look whats going downparanoia strikes deep into your life it will creep it starts when youre always afraid you step out of line the man come and take you awaywe better stop hey whats that sound everybody look whats going down stop hey whats that sound everybody look whats going down stop now whats that sound everybody look whats going down stop children whats that sound everybody look whats going down ",1
28,"gimme little sign","brenton wood",1967," if you do want me gimme little sugar if you dont want me dont lead me on girl but if you need me show me that you love me and when im feeling blue and i want you theres just one thing that you should dojust gimme some kind of sign girl oh my baby to show that youre mine girl oh yeahjust gimme some kind of sign girl oh my baby to show that youre mine girl all rightif you do want me gimme little sweet talk if you dont want me dont lead me on girl but if you need me show me that you love me and when im feeling down wearing a frown you be there when i look around ",1
29,"the happening","the supremes",1967," hey life look at me i can see the reality cause when you shook me took me outta my world i woke up suddenly i just woke up to the happening when you find that you left the future behind cause when you got a tender love you dont take care of then you better beware ofthe happening one day youre up when you turn around you find your world is tumbling down it happened to me and it can happen to youi was sure i felt secure until love took a detour yeah riding high on top of the world it happened suddenly it just happened i saw my dreams torn apart when love walked away from my heart and when you lose a precious love you need to guide you something happens inside youthe happening now i see life for what it is its not of dreams its not of bliss it happened to me and it can happen to you and then it happened oo and then it happened oo and then it happened oo and then it happened ",1
30,"all you need is love","the beatles",1967,"love love love love love love love love love theres nothing you can do that cant be done nothing you can sing that cant be sung nothing you can say but you can learn how to play the game its easy theres nothing you can make that cant me made no one you can save that cant be saved nothing you can do but you can learn how to be you in time its easy all you need is love all you need is love all you need is love love love is all you need love love love love love love love love love all you need is love all you need is love all you need is love love love is all you need theres nothing you can know that isnt known nothing you can see that isnt shown theres nowhere you can be that isnt where youre meant to be its easy all you need is love all you need is love all you need is love love love is all you need all you need is love all together now all you need is love everybody all you need is love love love is all you need love is all you need love is all you need love is all you need ",3
31,"release me","engelbert humperdinck",1967," please release me let me go for i dont love you anymore to waste our lives would be a sin release me and let me love againoh i i have found a new love dear and i i will always want her near her lips are warm while yours are cold release me my darlin let me goplease release me let me go for i dont love you anymore to waste my life would be a sin so release me and let me love againplease release me cant you see youd be a fool to cling to me to live a lie would bring us pain so release me and let me love again let me go let me go ",1
32,"your precious love","marvin gaye  tammi terrell",1967,"ooh every day theres something new honey to keep me lovin you and with every passin minute ah baby so much joy wrapped up in it oh heaven must have sent you from above oh heaven must have sent your precious love oh and i ive got a song to sing tellin the world about the joy you bring and you gave me a reason for livin and ooh you taught me you taught me the meaning of givin oh heaven must have sent you from above oh heaven must have sent your precious love oh to find a love like yours is rare these days cause youve shown me what happiness is in so many ways i look in the mirror and im glad to see laughter in the eyes where tears used to be what youve given me i could never return cause theres so much girl i have yet to learn honey and i wanna show i wanna show my appreciation cause when i found you i found a new inspiration oh heaven must have sent you from above oh heaven must have sent your precious love oh heaven must have sent you from above oh heaven must have sent your precious love",3
98,"macarena","los del r'io",1996," dale a tu cuerpo alegria macarena que tu cuerpo es pa darle alegria y cosa buena dale a tu cuerpo alegria macarena hey macarenadale a tu cuerpo alegria macarena que tu cuerpo es pa darle alegria y cosa buena dale a tu cuerpo alegria macarena hey macarenamacarena tiene un novio que se llama que se llama de apellido vitorino que en la jura de bandera el muchacho se la dio con dos amigosmacarena tiene un novio que se llama que se llama de apellido vitorino y en la jura de bandera el muchacho se la dio con dos amigosdale a tu cuerpo alegria macarena que tu cuerpo es pa darle alegria y cosa buena dale a tu cuerpo alegria macarena hey macarenadale a tu cuerpo alegria macarena que tu cuerpo es pa darle alegria y cosa buena dale a tu cuerpo alegria macarena hey macarenamacarena macarena macarena que te gustan los veranos de marbella macarena macarena macarena que te gusta la movida guerrilleradale a tu cuerpo alegria macarena que tu cuerpo es pa darle alegria y cosa buena dale a tu cuerpo alegria macarena hey macarenadale a tu cuerpo alegria macarena que tu cuerpo es pa darle alegria y cosa buena dale a tu cuerpo alegria macarena hey macarenamacarena suena con el corte ingles y se compra los modelos mas modernos le gustaria vivir en nueva york y ligar un novio nuevomacarena suena con el corte ingles y se compra los modelos mas modernos le gustaria vivir en nueva york y ligar un novio nuevodale a tu cuerpo alegria macarena que tu cuerpo es pa darle alegria y cosa buena dale a tu cuerpo alegria macarena hey macarenadale a tu cuerpo alegria macarena que tu cuerpo es pa darle alegria y cosa buena dale a tu cuerpo alegria macarena hey macarenamacarena tiene un novio que se llama que se llama de apellido vitorino y en la jura de bandera del muchacho se la dio con dos amigosmacarena tiene un novio que se llama que se llama de apellido vitorino y en la jura de bandera del muchacho se la dio con dos amigosdale a tu cuerpo alegria macarena que tu cuerpo es pa darle alegria y cosa buena dale a tu cuerpo alegria macarena hey macarenadale a tu cuerpo alegria macarena que tu cuerpo es pa darle alegria y cosa buena dale a tu cuerpo alegria macarena hey macarena ",1
99,"only wanna be with you","hootie  the blowfish",1996,"hootie and the blowfish cracked rear view only wanna be with you you and me we come from different worlds you like to laugh at me when i look at other girls sometimes youre crazy and you wonder why im such a baby cause the dolphins make me cry but theres nothing i can do ive been looking for a girl like you you look at me you got nothing left to say im gonna pout at you until i get my way i wont dance you wont sing i just wanna love you but you wanna wear my ring but theres nothing i can do i only wanna be with you you can call me your fool i only wanna be with you put on a little dylan sittin on a fence i said that line is great you asked me what it meant by said i shot a man named gray took his wife to italy she inherited a million bucks when she died it came to me i cant help it if im lucky i only wanna be with you aint bobby so cool i only wanna be with you yeah im tangled up in blue i only wanna be with you you can call your fool only wanna be with you sometimes i wonder if itll ever end you get so mad at me when i go out with my friends sometimes youre crazy and you wonder why im such a baby and the dolphins make me cry theres nothing i can do i only wanna be with you you can call me your fool i only wanna be with you yeah im tangled up in blue i only wanna be with you only wanna be with you only wanna be with you only wanna be with you",3
100,"dont cry","seal",1996," dont be so hard on yourself those tears are for someone else i hear your voice on the phone i hear you feel so alone my baby oh my baby please my baby my babywhen we were young and truth was paramount we were older then and we lived a life without any doubt those memories they seem so long agowhats become of them theyve all gone for sure when you feel like me i want you to know dont cry not alone dont cry tonight my baby dont cry youll always be loved dont cry tonight my babytoday i dreamed of friends i had before and i wonder why the ones who care dont call anymore my feelings hurt but you know i overcome the pain and im stronger now there cant be a fire unless theres a flamedont cry your not alone dont cry tonight my baby dont cry youll always be loved dont cry oh limousines and sycophants dont leave me now cause im afraid what youve done to me is now the wolf in my bedin my head in my head in my headthe challenges we took were hard enough they get harder now even when we think that weve had enough dont feel alone cause its i you understand im your sedative take a piece of me whenever you candont cry youre not alone dont be so hard on yourself dont cry tonight my baby these tears are for someone elsedont cry youll always be loved i hear your voice on the phone dont cry tonight sweet baby i hear you fear so alonedont cry dont cry dont cry dont you cry cry dont cry cause you still be loved dont cry dont cry tonight ohmy baby my baby my baby my baby my baby my baby my baby my baby my baby my baby my baby my baby my baby my baby my baby my baby my baby dont cry tonight youll still be loved ",1
1,"something about the way you look tonight  candle in the wind 1997","elton john",1997,NA,NA
2,"foolish games  you were meant for me","jewel",1997,NA,NA
3,"ill be missing you","puff daddy featuring faith evans and 112",1997," seems like yesterday we used to rock the show i lace the track you lock the flow so far from hanging on the block of dough notorious they got to know that life aint always what it seem to be words cant express what you mean to me and though youre gone we still a team through your family ill fulfill your dreams in the future cant wait to see if youll open up the gates for me reminisce sometime the night they took my friend try to black it out but it plays again when its weird feelin its really hard to conceal cant imagine all the pain i feel give everything to hear half your breath i know you still livin your life after deathevery step i take every move i make every single day every time i pray ill be missing youthinking of the day when you went away what a life to take what a bond to break ill be missing youits kind of hard wit you not around know you in heaven smilin down watchin us while we pray for you everyday we pray for you till the day we meet again in my heart is where ill keep you friend memories give me the strength i need to proceed strength i need to believe my thoughts big i just cant define wish i could turn back the hands of time bust in the 6 shop for new clothes and kicks you and me taking flicks making hits stages they receive you on still cant believe youre gone give anything to hear half your breath i know you still livin your life after deathevery step i take every move i make every single day every time i pray ill be missing youthinking of the day when you went away what a life to take what a bond to break ill be missing yousomebody tell me why on that morning when this life is over i know ill see your faceevery night i pray every step i take every move i make every single day every night i pray every step i take every move i make every single day every time i pray every step i take every move i make every single day every night i pray every step i take every move i make every single day every time i prayevery step i take every move i make every single day every time i pray ill be missing youthinking of the day when you went away what a life to take what a bond to break ill be missing youevery step i take every move i make every single day every time i pray ill be missing youthinking of the day when you went away what a life to take what a bond to break ill be missing youevery step i take every move i make every single day every time i pray ill be missing youthinking of the day when you went away ",1
4,"unbreak my heart","toni braxton",1997," lala lala la lala hah aaa aaa aah aaa aaadont leave me in all this pain dont leave me out in the rain come back and bring back my smile come and take these tears away i need your arms to hold me now the nights are so unkind bring back those nights when i held you beside meunbreak my heart say youll love me again undo this hurt you caused when you walked out the door and walked outta my life uncry these tears i cried so many nights unbreak my heart my hearttake back that sad word goodbye bring back the joy to my life dont leave me here with these tears come and kiss this pain away i cant forget the day you left time is so unkind and life is so cruel without you here beside meunbreak my heart say youll love me again undo this hurt you caused when you walked out the door and walked outta my life uncry these tears i cried so many nights unbreak my heart my heart heart ummdont leave me in all this pain dont leave me out in the rain bring back the nights when i held you beside meoh unbreak my heart say that youll love me again undo this hurt you caused when you walked out the door and walked outta my life uncry these tears i cried so many many nights oh unbreak myunbreak my heart oh baby come back and say you love me unbreak my heart sweet darlin without you i just cant go onsay that you love say that you love tell me you love unbreak my heart cant go on woh say that you love say that you love tell me you love unbreak my say that you love say that you love tell me you love unbreak my say that you love say that you love tell me ",1
5,"cant nobody hold me down","puff daddy featuring mase",1997," intro puff huh mase yo turn me up in the headphones puff like that mase yeah puff bad boy we aint goin stopverse one now its sean on the hot track melt like its hot wax put it out all the stores bet you could shout that even a nigga with a hot hat frontin like bad boy aint got tracks nigga stop that theres no guy slicker than this young fly nigga nickelnine liquor thought youd die quicker this phat time i tha town pie flipper turn krystal into a crooked ides sipper everybody want to be fast see the cash fuck around and reach staff get a heat rash anything in bad boy way we smash hundred g stash push a bulletproof eclass im through being a player and a baller just want me one bad bitch so i can spoil her mase wanna be the one respect even when you vex rock versace silks over spilled vnecks got green never seen so you suck my jewels clutch my ooze anything i touch i bruise puff think you dont know it nigga fuck your rules thats right goodfellas you know you cant touch us twochorus dont push us cause were close to the edge were tryin not to lose our head uh hah hahhah hah hahi get the feelin sometimes they make me wonder why you wanna take us under why you wanna take us under x2cant nobody take my pride cant nobody hold me down oh no i got to keep on movinverse two broken glass everywhere if it aint about the money puff i just dont care im that goodfella fly guy sometimes wiseguy spend time in hawaii mase could you please stop smokin la la puff why try im a thug im a die high i be out in jersey puffin hershey brothers aint worthy to rock my derby no im never drugged honey when im in the club g though i know the thug be wantin to slug me could it be i move as smoove as bugsy or be at the bar with too much bubbly naw i think it must be the girls want to lust me or is it simply the girls just love me brothers wanna rock my rolls rock my clothes rock my ice pull out glocks stop my life im like damn how these niggas got the type used to be my man how you gonna plot on my wife do you think you snake me cause they hate me or you got a phd player haters degreechorus verse three quit that you a big cat where your chicks at where your whips at wherever you get stacks im a fix that everything mass big dreams i did that dont knock me cause your borin our record sales soarin straight torin simply a lot of men be wantin to hand me cause their words just dont offend me we spend cheese in the west indies and come home to plenty cream bentlys you name it i can claim it young black and famous wit money hangin out the anus and when you need a hit who you go and get bet against us naw thats no bet we made hits thatll rearrange your whole set and i got a benz that i aint even drove yetchorus outro repeats and fades til end cant nobody take my pride cant nobody hold me down oh no i got to keep on movin ",1
6,"i believe i can fly","r kelly",1997," i used to think that i could not go on and life was nothing but an awful song but now i know the meaning of true love im leaning on the everlasting armsif i can see it then i can do it if i just believe it theres nothing to iti believe i can fly i believe i can touch the sky i think about it every night and day night and day spread my wings and fly away i believe i can soar i see me running through that open door i believe i can fly i believe i can fly i believe i can fly hoo  meaning  bygirlgirl3ooo     i think they mean that it can help your with the song    see all   see i was on the verge of breaking down sometimes silence can seem so loud there are miracles in life i must achieve but first i know it starts inside of me ho ohif i can see it hoo then i can be it if i just believe it theres nothing to iti believe i can fly i believe i can touch the sky i think about it every night and day spread my wings and fly away i believe i can soar i see me running through that open door i believe i can fly i believe i can fly oh i believe i can fly hoohey cause i believe in me ohif i can see it hoo then i can do it if i just believe it theres nothing to it heyi believe i can fly hoo i believe i can touch the sky i think about it every night and day spread my wings and fly away i believe i can soar i see me running through that open door i believe i can fly i can fly i believe i can fly i can fly i believe i can fly i can fly heyif i just spread my wings i can fly i can fly i can fly i can fly i can fly i can flyi can fly hey if i just spread my wings i can fly i can fly i can fly i can fly i can fly ",1
7,"dont let go love","en vogue",1997," whats it gonna be cause i cant pretend dont you wanna be more than friends hold me tight and dont let go dont let go do you have the right to lose control dont let goi often tell myself that we could be more than just friends i know you think that if we move to soon it would all end i live in misery when youre not around and i wont be satisfied till were taking those vowstherell be some lovemaking heartbreaking soul shaking oh lovemaking heartbreaking soul shakingwhats it gonna be cause i cant pretend dont you wanna be more than friends hold me tight and dont let go dont let go have the right to lose control dont let goi often fantasize the stars above are watching you they know my heart and speak to yours like only lovers do if i could wear your clothes id pretend i was you and lose controltherell be some lovemaking heartbreaking soul shaking oh lovemaking heartbreaking soul shakingwhats it gonna be cause i cant pretend dont you wanna be more than friends hold me tight and dont let go dont let go have the right to lose control dont let gorunning in and out my life has got me so confused you gotta make the sacrifice somebodys got to choose we can make it if we try for the sake of you and i together we can make it rightwhats it gonna be cause i cant pretend dont you wanna be more than friends hold me tight and dont let go dont let go have the right to lose control dont let godont let go dont let go cause i cant pretend whats it gonna be cause i cant pretend dont you wanna be more than friends hold me tight and dont let go dont let go have the right to lose control dont let gowhats it gonna be whats it gonna be hold me tight and dont let go ",1
